{
  "schema_version": "1.0.0",
  "match_id": "m-sample-001",
  "generated_at": "2026-10-18T17:00:00Z",
  "final_score": { "home": 2, "away": 1 },
  "brief": {
    "match_id": "m-sample-001",
    "seed": 7,
    "brief_text": "Rivermouth (4-3-3) press high, keep the ball patiently and hold a high line. Ashford Vale (4-4-2) drop off and wait, play direct and sit in a low block. Ashford score first on the break; Rivermouth equalise from a set piece and win it late.",
    "home": {
      "name": "Rivermouth", "short": "RIV", "formation": "4-3-3", "press": 0.82, "directness": 0.35, "line_height": 0.74,
      "players": [
        { "id": "home-01", "name": "Hale", "number": 1, "slot": 0, "pace": 7.2 },
        { "id": "home-02", "name": "Doyle", "number": 2, "slot": 1, "pace": 8.6 },
        { "id": "home-03", "name": "Varga", "number": 4, "slot": 2, "pace": 8.1 },
        { "id": "home-04", "name": "Kerr", "number": 5, "slot": 3, "pace": 8.0 },
        { "id": "home-05", "name": "Pell", "number": 3, "slot": 4, "pace": 8.7 },
        { "id": "home-06", "name": "Silva", "number": 6, "slot": 5, "pace": 8.3 },
        { "id": "home-07", "name": "Okafor", "number": 8, "slot": 6, "pace": 8.8 },
        { "id": "home-08", "name": "Mensah", "number": 10, "slot": 7, "pace": 8.5 },
        { "id": "home-09", "name": "Ruiz", "number": 7, "slot": 8, "pace": 9.4 },
        { "id": "home-10", "name": "Adeyemi", "number": 9, "slot": 9, "pace": 9.1 },
        { "id": "home-11", "name": "Brook", "number": 11, "slot": 10, "pace": 9.5 }
      ]
    },
    "away": {
      "name": "Ashford Vale", "short": "ASH", "formation": "4-4-2", "press": 0.28, "directness": 0.66, "line_height": 0.31,
      "players": [
        { "id": "away-01", "name": "Novak", "number": 1, "slot": 0, "pace": 7.0 },
        { "id": "away-02", "name": "Reyes", "number": 2, "slot": 1, "pace": 8.4 },
        { "id": "away-03", "name": "Moreau", "number": 5, "slot": 2, "pace": 7.9 },
        { "id": "away-04", "name": "Tanaka", "number": 6, "slot": 3, "pace": 8.0 },
        { "id": "away-05", "name": "Quinn", "number": 3, "slot": 4, "pace": 8.5 },
        { "id": "away-06", "name": "Brandt", "number": 8, "slot": 5, "pace": 8.9 },
        { "id": "away-07", "name": "Lindqvist", "number": 4, "slot": 6, "pace": 8.2 },
        { "id": "away-08", "name": "Osei", "number": 14, "slot": 7, "pace": 8.3 },
        { "id": "away-09", "name": "Laine", "number": 11, "slot": 8, "pace": 9.2 },
        { "id": "away-10", "name": "Okoye", "number": 9, "slot": 9, "pace": 9.3 },
        { "id": "away-11", "name": "Fenn", "number": 10, "slot": 10, "pace": 8.7 }
      ]
    },
    "storyline": { "id": "late_comeback", "text": "Ashford score first on the break; Rivermouth equalise from a set piece and win it late." },
    "planted_beats": [
      { "id": "pb-01", "kind": "counter_goal", "side": "away", "minute_from": 35, "minute_to": 45 },
      { "id": "pb-02", "kind": "set_piece_goal", "side": "home", "minute_from": 75, "minute_to": 85 },
      { "id": "pb-03", "kind": "high_turnover_goal", "side": "home", "minute_from": 90, "minute_to": 95 }
    ]
  },
  "facts": [
    {
      "id": "fx-counter-duration",
      "name": "t(ev-000600) - t(ev-000597)",
      "value": 11.2, "unit": "s",
      "display": { "en": ["11.2 s", "11.2 seconds", "11 seconds"], "es": ["11,2 s", "11 segundos"] },
      "scope": { "side": "away", "period": 1 },
      "source_ids": ["ev-000597", "ev-000600"],
      "extractor": { "name": "counter_timing", "version": "0.1.0" }
    },
    {
      "id": "fx-home-ahead-of-ball",
      "name": "freeze_frame(ev-000597).home_ahead_of_ball",
      "value": 3, "unit": "count",
      "display": { "en": ["3", "three"], "es": ["3", "tres"] },
      "source_ids": ["ff-000597"],
      "extractor": { "name": "freeze_frame_counts", "version": "0.1.0" }
    }
  ],
  "beats": [
    {
      "id": "bt-002", "kind": "counter_goal", "origin": "planted", "planted_beat_id": "pb-01", "side": "away",
      "t_detect": 2472, "t_from": 2443, "t_to": 2454, "label": "41′",
      "anchor_event_id": "ev-000597",
      "fact_ids": ["fx-counter-duration", "fx-home-ahead-of-ball"],
      "salience": 0.92, "rank": 2
    }
  ],
  "claims": [
    {
      "id": "cl-002-00", "beat_id": "bt-002", "lang": "en",
      "text": "Scored 11.2 s after winning the ball",
      "fact_ids": ["fx-counter-duration"],
      "numbers": [{ "as_written": "11.2 s", "fact_id": "fx-counter-duration" }],
      "verdict": "verified",
      "checker": { "reconciled": true, "judge_supported": true, "retries": 0, "model": "TBD", "latency_ms": 2140 }
    },
    {
      "id": "cl-002-01", "beat_id": "bt-002", "lang": "en",
      "text": "Rivermouth were caught with 3 players ahead of the ball when the press broke",
      "draft_text": "Rivermouth were caught with 4 players stranded upfield when the press broke",
      "fact_ids": ["fx-home-ahead-of-ball"],
      "numbers": [{ "as_written": "3", "fact_id": "fx-home-ahead-of-ball" }],
      "verdict": "rephrased",
      "reason": "Draft said 4 players. The freeze frame at ev-000597 shows 3, so the number was corrected.",
      "checker": { "reconciled": true, "judge_supported": true, "retries": 1, "model": "TBD", "latency_ms": 5310 }
    }
  ],
  "overlays": [
    {
      "beat_id": "bt-002", "t_in": 2443, "t_out": 2460, "freeze_frame_event_id": "ev-000597",
      "layers": [
        { "kind": "turnover", "side": "away", "event_id": "ev-000597", "from": [80, 32] },
        { "kind": "carry", "side": "away", "event_id": "ev-000598", "from": [80, 32], "to": [52, 26] },
        { "kind": "pass", "side": "away", "event_id": "ev-000599", "from": [52, 26], "to": [22, 38] },
        { "kind": "goal", "side": "away", "event_id": "ev-000600", "from": [22, 38], "to": [0, 41], "xg": 0.31, "claim_ids": ["cl-002-00"] }
      ]
    }
  ],
  "renderings": {
    "fan": { "en": { "bt-002": "Ashford broke the press and went the length of the pitch in 11 seconds." } }
  }
}
